{
  "$schema": "https://json-schema.org/draft/2020-12/schema",
  "title": "English Literature Book",
  "type": "object",
  "required": ["id", "title", "author", "year", "period", "genres", "description"],
  "properties": {
    "id": {"type": "string"},
    "title": {"type": "string"},
    "author": {"type": "string"},
    "year": {"type": ["integer", "null"]},
    "period": {"type": "string"},
    "genres": {"type": "array", "items": {"type": "string"}},
    "description": {"type": "string"},
    "themes": {"type": "array", "items": {"type": "string"}},
    "characters": {"type": "array", "items": {"type": "string"}},
    "chapters": {"type": "array", "items": {"type": "string"}}
  }
}